{
  "source_id": "src-6779f4028860",
  "source_kind": "document",
  "title": "Migration downtime: a field study",
  "bibliographic": {
    "item_type": "report",
    "title": "Migration downtime: a field study",
    "authors": [
      {
        "literal": "Fieldnotes Collective"
      }
    ],
    "issued": {
      "date_parts": [
        [
          2025
        ]
      ]
    }
  },
  "representations": [
    {
      "representation_id": "rep-be0de02db3cf",
      "role": "document_pdf",
      "media_type": "application/pdf",
      "path": "sources/fieldnotes-2025-migration-downtime-study/representations/paper.pdf",
      "sha256": "sha256:be0de02db3cfbe4c736e645a3fe245a65864119653b32dc0721f04bc05e86958",
      "bytes": 1485,
      "page_count": 2,
      "produced_by": "import",
      "provenance": {
        "produced_by": {
          "tool": "pi-forge",
          "tool_version": "0.2.0",
          "method": "import"
        },
        "created_at": "2026-08-17T12:00:00Z"
      }
    },
    {
      "representation_id": "rep-48eb8688f8c1",
      "role": "text",
      "media_type": "text/plain",
      "path": "sources/fieldnotes-2025-migration-downtime-study/representations/paper.txt",
      "sha256": "sha256:48eb8688f8c1068f36ff6df09faf63b24484651fa79f735d5d440954490e3d13",
      "bytes": 261,
      "char_count": 261,
      "parent_representation_ref": "rep-be0de02db3cf",
      "produced_by": "conversion",
      "provenance": {
        "produced_by": {
          "tool": "pi-forge",
          "tool_version": "0.2.0",
          "method": "conversion"
        },
        "created_at": "2026-08-17T12:00:00Z"
      }
    }
  ],
  "extractions_path": "sources/fieldnotes-2025-migration-downtime-study/extractions.jsonl",
  "provenance": {
    "produced_by": {
      "tool": "pi-forge",
      "tool_version": "0.2.0",
      "method": "import"
    },
    "created_at": "2026-08-17T12:00:00Z"
  }
}
