{
  "source_id": "src-6c028fe157b9",
  "source_kind": "document",
  "title": "Typeset note",
  "bibliographic": {
    "item_type": "document",
    "title": "Typeset note",
    "issued": {
      "date_parts": [
        [
          2026
        ]
      ]
    }
  },
  "representations": [
    {
      "representation_id": "rep-002493735202",
      "role": "clean_markdown",
      "media_type": "text/markdown",
      "path": "sources/note-typeset/representations/clean.md",
      "sha256": "sha256:0024937352022e61f01c33db453ae948a563cc40085fd7f0e4e36d0c9dbc1ba7",
      "char_count": 85,
      "produced_by": "conversion",
      "provenance": {
        "produced_by": {
          "tool": "t",
          "method": "conversion"
        },
        "created_at": "2026-08-17T12:00:00Z"
      }
    }
  ],
  "extractions_path": "sources/note-typeset/extractions.jsonl",
  "provenance": {
    "produced_by": {
      "tool": "t",
      "method": "manual"
    },
    "created_at": "2026-08-17T12:00:00Z"
  }
}
