{
  "source_id": "src-bacbb80a8fa2",
  "source_kind": "url",
  "title": "Conflicting copy",
  "retrieval": {
    "original_url": "https://example.org/conflict",
    "fetch_status": "success"
  },
  "representations": [
    {
      "representation_id": "rep-8389412e9ea7",
      "role": "clean_markdown",
      "media_type": "text/markdown",
      "path": "sources/note-conflict/representations/clean.md",
      "sha256": "sha256:f1c4aec913ad23e765ee17c7de1ea8bfb30de232c5efa131625bbfcbc904ad9c",
      "produced_by": "manual",
      "provenance": {
        "produced_by": {
          "tool": "t",
          "method": "manual"
        },
        "created_at": "2026-08-17T12:00:00Z"
      }
    }
  ],
  "provenance": {
    "produced_by": {
      "tool": "t",
      "method": "manual"
    },
    "created_at": "2026-08-17T12:00:00Z"
  }
}
