{
  "source_id": "src-949aacb64bb8",
  "source_kind": "url",
  "title": "Syndicated copy",
  "retrieval": {
    "original_url": "https://example.org/syndicated",
    "fetch_status": "success"
  },
  "representations": [
    {
      "representation_id": "rep-8389412e9ea7",
      "role": "clean_markdown",
      "media_type": "text/markdown",
      "path": "sources/note-copy/representations/clean.md",
      "sha256": "sha256:8389412e9ea792add58bb528fff88b6d201eb0573272bfc144091c01d365dabd",
      "produced_by": "manual",
      "provenance": {
        "produced_by": {
          "tool": "t",
          "method": "manual"
        },
        "created_at": "2026-08-17T12:00:00Z"
      }
    }
  ],
  "provenance": {
    "produced_by": {
      "tool": "t",
      "method": "manual"
    },
    "created_at": "2026-08-17T12:00:00Z"
  }
}
