{
  "source_id": "src-c76847068a0a",
  "source_kind": "document",
  "title": "Note",
  "bibliographic": {
    "item_type": "document",
    "title": "Note",
    "issued": {
      "date_parts": [
        [
          2026
        ]
      ]
    }
  },
  "representations": [
    {
      "representation_id": "rep-8389412e9ea7",
      "role": "clean_markdown",
      "media_type": "text/markdown",
      "path": "sources/note-migration/representations/clean.md",
      "sha256": "sha256:0000000000000000000000000000000000000000000000000000000000000000",
      "char_count": 131,
      "produced_by": "manual",
      "provenance": {
        "produced_by": {
          "tool": "t",
          "method": "manual"
        },
        "created_at": "2026-08-17T12:00:00Z"
      }
    }
  ],
  "extractions_path": "sources/note-migration/extractions.jsonl",
  "provenance": {
    "produced_by": {
      "tool": "t",
      "method": "manual"
    },
    "created_at": "2026-08-17T12:00:00Z"
  }
}
